Question,Correct Answer,Given Answer,Score,Justification,Execution Time (s)
What does Harry accidentally do when he goes to the zoo?,Make the glass in the snake enclosure disappear,Harry accidentally sets a boa constrictor named 'Romeus' on his cousin Dudley during their visit to the zoo.,0,"The given answer is wrong. In the given answer, Harry sets a boa constrictor on his cousin at the zoo, while in the correct answer, Harry makes the glass in the snake enclosure disappear.",3.60
What are the names of Severus Snape's parents?,Tobias Snape (father) and Eileen Snape (Prince) (mother),Tobias Snape (father) and Eileen Prince (mother),2,"The given answer is incomplete as it only states the correct name of one parent. However, both parents' names are mentioned in the question and in the correct answer.",2.58
"What is the name of the Quidditch move where a seeker fake's seeing the snitch and dives to the ground but pullsout of the dive just in time, but the opposing seeker plummets to the ground?",Wronsky Feint,"The name of this Quidditch move is called 'Punches and Tenders'. The seeking who pretends to have spotted the Snitch makes an exaggerated dive for it, but pulls out just before contact with the ground. The opposing seeker who has mistakenly targeted the diving player plummets to the ground.",0,The given answer is wrong as it provides an incorrect name for the Quidditch move 'Punches and Tenders' instead of 'Wronsky Feint',73.28
What is the first-ever password to Gryffindor Tower?,Caput Draconis,There is no mention of the first-ever password to Gryffindor Tower in the given extract.,1,The given answer states that there is no answer for the question.,2.22
Why did Cormac McLaggen miss the Quidditch tryouts in the year previous to Harry Potter and the Half-Blood Prince?,He ate a pound of doxy eggs for a bet.,There is no information provided in the text about why Cormac McLaggen missed the Quiddich tryouts in the year preceding Harry Potter and Half-Blood Prince.,1,The given answer is empty and does not provide any information relevant to the question.,3.82
What magical plant does Harry use to breathe underwater during the second task of the Triwizard Tournament?,Gillyweed,Gillyweed,3,The given answer is identical to the correct answer. Both contain the word 'Gillyweed'. This indicates a complete and correct answer.,2.63
